[
  { "id": "creature-salt-hound", "name": "Salt-Hound", "biomeId": "biome-salt-shallows", "archetype": "pack-hunter", "stats": { "hp": 40, "damage": 8, "speed": 1.2 }, "drops": [{ "itemId": "item-salt", "qty": 2 }], "tame": { "$comment": "instinct effect magnitudes/radii are invented (VILLAGER-AND-GODHEAD-SPEC Part III gives the fantasy — 'damage mult', 'range grows', 'hits briefly pin' — but no numbers). Fangs +20% dmg; Blood-Scent +50% growl-radar range; Deathgrip pins 1.2s, first-guess. behavior mirrors arms-warrior's engageRange/breakHpPct verbatim per the spec's instruction ('fighter kit off its own level... in line with the Arms warrior behavior numbers').", "tier": 2, "cravedFoodItemId": "item-crab-meat", "meals": 3, "behavior": { "role": "fighter", "engageRange": 6, "breakHpPct": 0.15 }, "instincts": [ { "tier": 3, "id": "instinct-fangs", "name": "Fangs", "text": "The bite means it now.", "effects": [ { "type": "damage-mult", "magnitude": 1.2, "target": "self" } ] }, { "tier": 6, "id": "instinct-blood-scent", "name": "Blood-Scent", "text": "The dried sea keeps no secrets from a nose it made — the growl finds trouble from further off.", "effects": [ { "type": "growl-range-mult", "magnitude": 1.5, "target": "self" } ] }, { "tier": 9, "id": "instinct-deathgrip", "name": "Deathgrip", "text": "It doesn't let go right away. Neither should you.", "effects": [ { "type": "pin-on-hit", "duration": 1.2, "target": "enemy" } ] } ], "namePool": ["Fang", "Gnash", "Brack", "Skarr", "Howler", "Rip"], "keepsakeItemId": "item-hound-fang" }, "text": "Runs in threes. The white coat isn't fur." },
  { "id": "creature-scuttle-crab", "name": "Scuttle-Crab", "biomeId": "biome-salt-shallows", "archetype": "ambient", "stats": { "hp": 15, "damage": 3, "speed": 0.7 }, "drops": [{ "itemId": "item-crab-meat", "qty": 2 }], "tame": { "$comment": "instinct effect magnitudes/radii are invented (spec gives the fantasy, not numbers). Deep Pockets is the spec's own '+2 more carry' verbatim. Old Barnacle: hound aggro x0.7 within 6m, first-guess ('walking calm', no radius given). Tide-Shell has no magnitude — it's a boolean guard the presentation layer reads (player-only, once per day), same shape as arms talents with a params flag.", "tier": 1, "cravedFoodItemId": "item-smoked-crab", "meals": 2, "behavior": { "role": "porter", "carrySlots": 2 }, "instincts": [ { "tier": 3, "id": "instinct-deep-pockets", "name": "Deep Pockets", "text": "It found room. It always finds room.", "effects": [ { "type": "carry-slots-add", "magnitude": 2, "target": "self" } ] }, { "tier": 6, "id": "instinct-tide-shell", "name": "Tide-Shell", "text": "Once a day, the shell remembers it isn't just its own to guard.", "effects": [ { "type": "block-hit-for-owner", "target": "self", "params": { "oncePerDay": true, "ownerOnly": true } } ] }, { "tier": 9, "id": "instinct-old-barnacle", "name": "Old Barnacle", "text": "Something this old and this calm makes even a hound think twice.", "effects": [ { "type": "hound-aggro-mult", "magnitude": 0.7, "radius": 6, "target": "area" } ] } ], "namePool": ["Skitter", "Brine", "Pinch", "Shuckle", "Tidenail", "Barnacle"], "keepsakeItemId": "item-shell-plate" }, "text": "Mostly harmless. Excellent soup. Old Ghal is watching how you phrase that." },
  { "id": "creature-dust-eel", "name": "Dust-Eel", "biomeId": "biome-salt-shallows", "archetype": "ambusher", "stats": { "hp": 30, "damage": 14, "speed": 1.5 }, "drops": [{ "itemId": "item-rope", "qty": 1 }, { "itemId": "item-eel-meat", "qty": 2 }], "text": "The flats look flat. The flats are not flat." },
  { "id": "creature-raider", "name": "Flats Raider", "biomeId": "biome-salt-shallows", "archetype": "raider-human", "stats": { "hp": 60, "damage": 10, "speed": 1.0 }, "drops": [{ "itemId": "item-bronze-salvage", "qty": 1 }], "text": "Desperate, organized, and takeable — subdue instead of slay and the yoke-post has a customer." },
  { "id": "creature-old-shellback", "name": "Old Shellback", "workingName": true, "biomeId": "biome-salt-shallows", "archetype": "boss", "stats": { "hp": 900, "damage": 30, "speed": 0.6 }, "drops": [{ "itemId": "item-bronze-salvage", "qty": 10 }, { "itemId": "item-harpoon-verse", "qty": 1 }], "remnantItemId": "item-remnant-shellback", "bossNotes": "A crab the size of a chapel wearing a hull as a shell. Teaches the boss grammar: preparation (fire the barnacle clusters), arena (the wreck-ring), weak-point (the old harpoon scar — a whaler put it there and didn't live to write a fourth verse; Shellback keeps what beats him, which is why the verse is in his hoard). Band-1 keystone: his death opens the wreck-ring's salvage and, someday, the descent. Killing him removes the flats' apex — hound packs grow. He is not evil; he is the world's thesis: endure by wearing the wreckage of what you lost.", "text": "'Shellback' is old sailor-talk for a mariner who crossed the equator — an initiated salt of the deep water. He is the oldest sailor left, still wearing his ship home. The village children say 'Old Shipback,' and no priest has the heart to correct them." },
  { "id": "creature-eel-wolf", "name": "Eel-Wolf", "biomeId": "biome-reef-forest", "archetype": "pack-hunter", "$comment": "M3.a review against CRAFT-AND-BUILD-SPEC's B2 enemy-damage rule ('B2 hostiles hit ~2x B1'): salt-hound (B1 pack-hunter baseline) hits for 8 -> the 2x band is 16, exactly this creature's existing damage. No change needed; hp 70 vs the hound's 40 is the spec's own headroom for the armor ladder underneath it.", "stats": { "hp": 70, "damage": 16, "speed": 1.3 }, "drops": [{ "itemId": "item-reef-iron", "qty": 1 }], "text": "What the reef made when it had to choose between its two best ideas." },
  { "id": "creature-urchin-back", "name": "Urchin-Back", "biomeId": "biome-reef-forest", "archetype": "ambient-armored", "$comment": "new archetype (M3.a): harmless until struck, then a slow pursuit (enemy.gd: peaceful like 'ambient' until on_hit() sets provoked, then behaves like any other chaser at its own slow speed). hp/damage are first guesses — modest, an armored crab-analog: hp above scuttle-crab's 15 (the shell earns something), damage low and roughly half a hound's, well under the B2 x2 law since it is never the aggressor.", "stats": { "hp": 50, "damage": 6, "speed": 0.5 }, "drops": [{ "itemId": "item-urchin-meat", "qty": 2 }, { "itemId": "item-dye", "qty": 1 }], "text": "Mostly harmless, if you leave it be. It has never once started anything." },
  { "id": "creature-the-drowned", "name": "The Drowned", "biomeId": "biome-reef-forest", "archetype": "the-drowned", "nightOnly": true, "stats": { "hp": 55, "damage": 12, "speed": 0.8 }, "drops": [], "text": "Dead sailors who don't know the sea left. They walk up out of the low places at night, still doing their work. Laying one to rest is a calling; there are kinder verbs than 'kill'." },
  { "id": "creature-angler-stalker", "name": "Angler-Stalker", "biomeId": "biome-reef-forest", "archetype": "lure", "nightOnly": true, "stats": { "hp": 85, "damage": 22, "speed": 1.1 }, "drops": [{ "itemId": "item-pearl", "qty": 1 }], "text": "A friendly light in a dark place. The game's face: it might be safety, and it might not." },
  { "id": "creature-anglermother", "name": "The Anglermother", "biomeId": "biome-reef-forest", "archetype": "boss", "stats": { "hp": 1600, "damage": 40, "speed": 0.9 }, "drops": [{ "itemId": "item-pearl", "qty": 8 }], "remnantItemId": "item-remnant-shellback", "bossNotes": "PLACEHOLDER remnant id — needs own remnant item. Fight in the dark; her lure is the only light and you need it to see. She has been calling your tribesmen in their dreams — village dread events foreshadow her for days.", "text": "The light in the deep wood." },
  { "id": "creature-drowned-priest", "name": "The Drowned Priest", "biomeId": "biome-the-drop", "archetype": "boss", "stats": { "hp": 2500, "damage": 50, "speed": 0.7 }, "drops": [], "bossNotes": "Not (only) a fight. The All-Tide's last high priest, holding a three-generation rite. Reaching him is the EA climax and the Verdict fork: join the rite, sever it with Ur-Noth's blessing, or take the thread. L3 lore lands here.", "text": "He has been waiting longer than your family has existed. He is not surprised to see you." }
]
